{
  "$schema": "./catalog.schema.json",
  "schemaVersion": "1.0.0",
  "catalogId": "primoria.interactive-visualization",
  "scope": {
    "disciplinePolicy": "all-subjects",
    "selectionUnit": "one-teaching-scene",
    "fallbackPolicy": "sandbox-widget"
  },
  "interactionArchetypes": [
    "observe",
    "adjust",
    "drag",
    "sequence",
    "compare",
    "annotate",
    "construct",
    "classify",
    "simulate",
    "explore-spatial"
  ],
  "components": [
    {
      "componentId": "physics.lens-imaging",
      "version": 1,
      "name": {
        "en": "Lens imaging",
        "zh-CN": "透镜成像"
      },
      "catalogDescription": {
        "en": "Convex and concave lens imaging with principal rays, image distance, and magnification.",
        "zh-CN": "凸凹透镜成像、三条特殊光线、像距与放大率。"
      },
      "teachingPurpose": {
        "en": "Connect object distance and focal length to image position, orientation, and scale.",
        "zh-CN": "建立物距、焦距与像的位置、方向和大小之间的联系。"
      },
      "primaryAction": "drag",
      "disciplineTags": [
        "physics",
        "optics"
      ],
      "capabilityTags": [
        "ray-diagram",
        "thin-lens",
        "derived-readout"
      ],
      "implementation": {
        "status": "implemented",
        "rendererKey": "lensImaging"
      },
      "configSchema": {
        "type": "object",
        "additionalProperties": false,
        "properties": {
          "lensType": {
            "type": "string",
            "enum": [
              "convex",
              "concave"
            ],
            "default": "convex"
          },
          "focalLength": {
            "type": "number",
            "minimum": 4,
            "maximum": 30,
            "default": 10
          },
          "objectDistance": {
            "type": "number",
            "minimum": 2,
            "maximum": 60,
            "default": 30
          },
          "objectHeight": {
            "type": "number",
            "minimum": 3,
            "maximum": 16,
            "default": 8
          },
          "showRays": {
            "type": "boolean",
            "default": true
          }
        },
        "required": [
          "lensType",
          "focalLength",
          "objectDistance",
          "objectHeight",
          "showRays"
        ],
        "default": {
          "lensType": "convex",
          "focalLength": 10,
          "objectDistance": 30,
          "objectHeight": 8,
          "showRays": true
        }
      },
      "patchHints": [
        {
          "en": "Inside the focal point means objectDistance is less than focalLength.",
          "zh-CN": "“焦点以内”表示 objectDistance 小于 focalLength。"
        },
        {
          "en": "A little larger or smaller changes the current numeric value by about 30%.",
          "zh-CN": "“调大或调小一点”按当前数值约 30% 调整。"
        }
      ],
      "fallbackConditions": [
        {
          "en": "Fall back for compound lenses, aberrations, or non-thin-lens optics.",
          "zh-CN": "复合透镜、像差或非薄透镜模型应降级。"
        }
      ],
      "examplePrompts": [
        {
          "en": "Show a convex lens with a 10 cm focal length and the object at 30 cm.",
          "zh-CN": "演示焦距 10cm、物距 30cm 的凸透镜成像。"
        },
        {
          "en": "Move the object inside the focal point.",
          "zh-CN": "把物体移到焦点以内。"
        }
      ]
    },
    {
      "componentId": "chem.acid-base-titration",
      "version": 1,
      "name": {
        "en": "Strong acid-base titration",
        "zh-CN": "强酸强碱滴定"
      },
      "catalogDescription": {
        "en": "Strong acid and strong base titration curve with equivalence point and indicator range.",
        "zh-CN": "强酸强碱滴定曲线、等当点与指示剂变色区间。"
      },
      "teachingPurpose": {
        "en": "Relate added titrant volume to pH and equivalence-point behaviour.",
        "zh-CN": "理解滴定剂体积、pH 与等当点变化之间的关系。"
      },
      "primaryAction": "adjust",
      "disciplineTags": [
        "chemistry"
      ],
      "capabilityTags": [
        "titration-curve",
        "equivalence-point",
        "indicator-range"
      ],
      "implementation": {
        "status": "implemented",
        "rendererKey": "acidBaseTitration"
      },
      "configSchema": {
        "type": "object",
        "additionalProperties": false,
        "properties": {
          "acidConcentration": {
            "type": "number",
            "minimum": 0.01,
            "maximum": 0.5,
            "default": 0.1
          },
          "acidVolume": {
            "type": "number",
            "minimum": 10,
            "maximum": 50,
            "default": 25
          },
          "baseConcentration": {
            "type": "number",
            "minimum": 0.01,
            "maximum": 0.5,
            "default": 0.1
          },
          "addedBaseVolume": {
            "type": "number",
            "minimum": 0,
            "maximum": 100,
            "default": 0
          },
          "indicator": {
            "type": "string",
            "enum": [
              "phenolphthalein",
              "methyl-orange",
              "none"
            ],
            "default": "phenolphthalein"
          }
        },
        "required": [
          "acidConcentration",
          "acidVolume",
          "baseConcentration",
          "addedBaseVolume",
          "indicator"
        ],
        "default": {
          "acidConcentration": 0.1,
          "acidVolume": 25,
          "baseConcentration": 0.1,
          "addedBaseVolume": 0,
          "indicator": "phenolphthalein"
        }
      },
      "patchHints": [
        {
          "en": "Add one drop means increasing addedBaseVolume by 0.1 mL.",
          "zh-CN": "“加一滴”表示 addedBaseVolume 增加 0.1mL。"
        },
        {
          "en": "At equivalence sets the added base amount from the acid and base mole ratio.",
          "zh-CN": "“调到等当点”按酸碱物质的量计算 addedBaseVolume。"
        }
      ],
      "fallbackConditions": [
        {
          "en": "Weak acids, buffers, and polyprotic systems require another component.",
          "zh-CN": "弱酸、缓冲体系和多元酸需要其他组件。"
        }
      ],
      "examplePrompts": [
        {
          "en": "Titrate 25 mL of 0.1 M hydrochloric acid with 0.1 M sodium hydroxide.",
          "zh-CN": "用 0.1M NaOH 滴定 25mL、0.1M 的盐酸。"
        },
        {
          "en": "Add base until the equivalence point.",
          "zh-CN": "加碱直到等当点。"
        }
      ]
    },
    {
      "componentId": "physics.wave-superposition",
      "version": 1,
      "name": {
        "en": "Wave superposition",
        "zh-CN": "波的叠加"
      },
      "catalogDescription": {
        "en": "Two harmonic waves and their resultant with adjustable amplitude, frequency, and phase.",
        "zh-CN": "两列简谐波及其合成波，振幅、频率和相位可调。"
      },
      "teachingPurpose": {
        "en": "Build intuition for constructive, destructive, and beat-like superposition.",
        "zh-CN": "建立相长、相消及拍频式叠加的直觉。"
      },
      "primaryAction": "adjust",
      "disciplineTags": [
        "physics",
        "music",
        "engineering"
      ],
      "capabilityTags": [
        "harmonic-wave",
        "superposition",
        "animated-curve"
      ],
      "implementation": {
        "status": "implemented",
        "rendererKey": "waveSuperposition"
      },
      "configSchema": {
        "type": "object",
        "additionalProperties": false,
        "properties": {
          "amplitude1": {
            "type": "number",
            "minimum": 0.2,
            "maximum": 2,
            "default": 1
          },
          "amplitude2": {
            "type": "number",
            "minimum": 0.2,
            "maximum": 2,
            "default": 1
          },
          "frequency1": {
            "type": "number",
            "minimum": 0.5,
            "maximum": 3,
            "default": 1
          },
          "frequency2": {
            "type": "number",
            "minimum": 0.5,
            "maximum": 3,
            "default": 1
          },
          "phaseDiffDeg": {
            "type": "number",
            "minimum": 0,
            "maximum": 360,
            "default": 0
          },
          "showComponents": {
            "type": "boolean",
            "default": true
          }
        },
        "required": [
          "amplitude1",
          "amplitude2",
          "frequency1",
          "frequency2",
          "phaseDiffDeg",
          "showComponents"
        ],
        "default": {
          "amplitude1": 1,
          "amplitude2": 1,
          "frequency1": 1,
          "frequency2": 1,
          "phaseDiffDeg": 0,
          "showComponents": true
        }
      },
      "patchHints": [
        {
          "en": "Completely cancel means equal amplitudes and frequencies with phaseDiffDeg set to 180.",
          "zh-CN": "“完全抵消”表示等振幅、等频率且 phaseDiffDeg 为 180。"
        },
        {
          "en": "Make the second wave faster increases frequency2 by about 30%.",
          "zh-CN": "“第二列波快一点”表示 frequency2 增加约 30%。"
        }
      ],
      "fallbackConditions": [
        {
          "en": "Nonlinear waves, dispersion, and multi-dimensional fields require another simulation.",
          "zh-CN": "非线性波、色散和多维波场需要其他模拟。"
        }
      ],
      "examplePrompts": [
        {
          "en": "Show two equal waves in phase.",
          "zh-CN": "演示两列等幅同相波。"
        },
        {
          "en": "Set the phase difference to 180 degrees.",
          "zh-CN": "把相位差调到 180 度。"
        }
      ]
    },
    {
      "componentId": "cs.sorting-steps",
      "version": 1,
      "name": {
        "en": "Sorting steps",
        "zh-CN": "排序分步"
      },
      "catalogDescription": {
        "en": "Step through bubble, selection, or insertion sorting with comparisons and swaps.",
        "zh-CN": "逐步执行冒泡、选择或插入排序并显示比较与交换。"
      },
      "teachingPurpose": {
        "en": "Connect algorithm rules to the exact sequence of comparisons and mutations.",
        "zh-CN": "把算法规则与具体比较、交换过程对应起来。"
      },
      "primaryAction": "sequence",